{
  "observed_at": "2026-10-20",
  "source_url": "https://chatgpt.com/images/",
  "conversation_url": "urn:image-production:private-conversation:01",
  "method": "Native Comet UI accessibility and screenshot through CUA; no hidden state",
  "card": "Cartaz",
  "category": "Modelos",
  "observed": {
    "card_description": "Pôster em um cartão creme, com uma papoula vermelha e a palavra BLOOM em letras grandes, sobre um fundo laranja.",
    "prompt": "Crie um cartaz que expresse minha ideia com uma hierarquia clara, textos obrigatórios legíveis, imagens e tipografia que funcionem em conjunto no contexto de visualização previsto. Preserve todos os detalhes exatamente como foram fornecidos; não invente nomes, datas, locais, patrocinadores ou logotipos, nem inclua texto adicional.\n\nFaça perguntas para esclarecer e definir a mensagem, o conteúdo obrigatório, o layout e o estilo visual do cartaz. Apresente opções relevantes de layout e estilo visual quando disponíveis.",
    "pre_submit_controls": {
      "aspect_ratio": [
        "Automático",
        "1:1",
        "2:3",
        "3:2",
        "16:9",
        "9:16"
      ],
      "default_aspect_ratio": "Automático",
      "suggested_photos": [
        "Enviar uma foto",
        "Foto 1",
        "Foto 2",
        "Foto 3",
        "Foto 4"
      ],
      "actions": [
        "Ver mais",
        "Ver menos",
        "Fechar caixa de diálogo",
        "Experimente"
      ]
    },
    "transition": "Experimente submitted the template prompt and opened a conversation. ChatGPT then responded with six clarification questions after 58 seconds of displayed thinking.",
    "questions": [
      {
        "id": "q1",
        "text": "Qual é a ideia central?",
        "input": "free_text",
        "details": "O que o cartaz deve comunicar e o que você quer provocar em quem o vê: curiosidade, impacto, reflexão, identificação, vontade de participar ou outra reação?",
        "evidence_refs": [
          "cartaz-initial-ui"
        ],
        "options": [],
        "allows_free_text": true
      },
      {
        "id": "q2",
        "text": "Qual é o texto obrigatório?",
        "input": "free_text",
        "details": "Cole o texto completo exatamente como deverá aparecer, incluindo grafia, pontuação e maiúsculas. Se houver uma frase ou informação que deva receber mais destaque, indique.",
        "evidence_refs": [
          "cartaz-initial-ui"
        ],
        "options": [],
        "allows_free_text": true
      },
      {
        "id": "q3",
        "text": "Onde e por quem ele será visto?",
        "input": "free_text",
        "details": "Informe o uso previsto: impressão, publicação no Instagram, story, WhatsApp, tela ou outro contexto. Diga também quem é o público e, se houver, o tamanho obrigatório. Se ainda não souber as dimensões, basta informar o uso.",
        "evidence_refs": [
          "cartaz-initial-ui"
        ],
        "options": [],
        "allows_free_text": true
      },
      {
        "id": "q4",
        "text": "Qual composição você prefere?",
        "input": "conversational_choice",
        "options": [
          {
            "value": "A",
            "label": "Texto protagonista",
            "description": "Tipografia ocupa a maior parte do cartaz; imagens e elementos gráficos têm papel de apoio.",
            "id": "q4-A",
            "evidence_refs": [
              "cartaz-initial-ui"
            ]
          },
          {
            "value": "B",
            "label": "Imagem protagonista",
            "description": "Uma imagem concentra a atenção; o texto entra em uma área de leitura bem definida.",
            "id": "q4-B",
            "evidence_refs": [
              "cartaz-initial-ui"
            ]
          },
          {
            "value": "C",
            "label": "Composição editorial",
            "description": "Texto e imagem dividem o espaço, com alinhamentos precisos e hierarquia organizada.",
            "id": "q4-C",
            "evidence_refs": [
              "cartaz-initial-ui"
            ]
          },
          {
            "value": "D",
            "label": "Composição dinâmica",
            "description": "Assimetria, diferenças de escala e uso expressivo do espaço criam movimento e tensão visual.",
            "id": "q4-D",
            "evidence_refs": [
              "cartaz-initial-ui"
            ]
          }
        ],
        "evidence_refs": [
          "cartaz-initial-ui"
        ],
        "allows_free_text": null
      },
      {
        "id": "q5",
        "text": "Que linguagem visual combina com sua ideia?",
        "input": "conversational_choice_or_combination",
        "options": [
          {
            "label": "Minimalista",
            "description": "poucos elementos, bastante espaço livre e contraste controlado.",
            "id": "q5-1",
            "evidence_refs": [
              "cartaz-initial-ui"
            ]
          },
          {
            "label": "Artística e poética",
            "description": "metáfora visual, textura e significados sugeridos.",
            "id": "q5-2",
            "evidence_refs": [
              "cartaz-initial-ui"
            ]
          },
          {
            "label": "Gráfica e contundente",
            "description": "formas marcantes, tipografia forte e contraste alto.",
            "id": "q5-3",
            "evidence_refs": [
              "cartaz-initial-ui"
            ]
          },
          {
            "label": "Fotográfica",
            "description": "fotografia como base, com tratamento de luz e cor coerente com a mensagem.",
            "id": "q5-4",
            "evidence_refs": [
              "cartaz-initial-ui"
            ]
          },
          {
            "label": "Retrô e impressa",
            "description": "linguagem de cartazes antigos, gravura, colagem ou serigrafia.",
            "id": "q5-5",
            "evidence_refs": [
              "cartaz-initial-ui"
            ]
          }
        ],
        "evidence_refs": [
          "cartaz-initial-ui"
        ],
        "allows_free_text": null
      },
      {
        "id": "q6",
        "text": "O que deve ser usado ou evitado?",
        "input": "free_text_or_attachments",
        "details": "Anexe imagens, referências ou logotipos que devam entrar no cartaz. Informe também cores obrigatórias, elementos proibidos e qualquer preferência de tipografia. Se enviar uma referência, diga o que deseja aproveitar nela: composição, cores, fonte, imagem ou atmosfera.",
        "evidence_refs": [
          "cartaz-initial-ui"
        ],
        "options": [],
        "allows_free_text": true
      },
      {
        "id": "bq1",
        "text": "Que interpretação de “Projeto Aurora” deve orientar o cartaz?",
        "options": [
          {
            "value": "A",
            "label": "Imponência e domínio",
            "description": "transmitir autoridade, força e a dureza de uma vitória.",
            "id": "bq1-A",
            "evidence_refs": [
              "cartaz-followup-ui"
            ]
          },
          {
            "value": "B",
            "label": "Vulnerabilidade e consequência",
            "description": "enfatizar a fragilidade e o peso da derrota.",
            "id": "bq1-B",
            "evidence_refs": [
              "cartaz-followup-ui"
            ]
          },
          {
            "value": "C",
            "label": "Tensão ambígua",
            "description": "fazer poder e fragilidade coexistirem, permitindo diferentes interpretações.",
            "id": "bq1-C",
            "evidence_refs": [
              "cartaz-followup-ui"
            ]
          }
        ],
        "when": [
          {
            "question_id": "q1",
            "operator": "text_equals",
            "value": "Projeto Aurora",
            "evidence_refs": [
              "cartaz-answer-ui"
            ]
          },
          {
            "question_id": "q2",
            "operator": "text_equals",
            "value": "Projeto Aurora",
            "evidence_refs": [
              "cartaz-answer-ui"
            ]
          },
          {
            "question_id": "q4",
            "operator": "option_selected",
            "value": "q4-D",
            "evidence_refs": [
              "cartaz-answer-ui"
            ]
          },
          {
            "question_id": "q3",
            "operator": "other",
            "value": "other_fields: em aberto",
            "evidence_refs": [
              "cartaz-answer-ui"
            ]
          },
          {
            "question_id": "q5",
            "operator": "other",
            "value": "other_fields: em aberto",
            "evidence_refs": [
              "cartaz-answer-ui"
            ]
          },
          {
            "question_id": "q6",
            "operator": "other",
            "value": "other_fields: em aberto",
            "evidence_refs": [
              "cartaz-answer-ui"
            ]
          },
          {
            "question_id": "q1",
            "operator": "other",
            "value": "generation_prohibited: true",
            "evidence_refs": [
              "cartaz-answer-ui"
            ]
          }
        ],
        "evidence_refs": [
          "cartaz-followup-ui"
        ],
        "allows_free_text": null
      },
      {
        "id": "bq2",
        "text": "Onde o cartaz será visto e por quem?",
        "options": [
          {
            "value": "A",
            "label": "Digital, principalmente no celular",
            "description": "informe o canal, se já estiver definido.",
            "id": "bq2-A",
            "evidence_refs": [
              "cartaz-followup-ui"
            ]
          },
          {
            "value": "B",
            "label": "Impresso, para parede ou exposição",
            "description": "informe o tamanho aproximado, se souber.",
            "id": "bq2-B",
            "evidence_refs": [
              "cartaz-followup-ui"